{
  "id": "audit-1",
  "zone_id": "zone-1",
  "event_type": "token.exchange",
  "request_id": "req-1",
  "decision": "allow",
  "policy_set_id": "policy-set-1",
  "policy_set_version_id": "policy-set-version-1",
  "manifest_sha": "sha256:3a6eb0790f39ac87c94f3856b2dd2c5d110e6811602261a9a923d3bb23adc8b7",
  "evaluation_status": "complete",
  "determining_policies_json": [
    {
      "id": "baseline-resource-scope"
    }
  ],
  "diagnostics_json": [
    {
      "code": "scope_allowed"
    }
  ],
  "metadata_json": {
    "resource": "resource://api",
    "trace_id": "4bf92f3577b34da6a3ce929d0e0e4736"
  },
  "occurred_at": "2026-05-21T12:00:00Z"
}
